{
  "version": "1.0.0",
  "deckId": "pccu-1151-bigdata-2026-10-17",
  "deckPath": "pccu-1151-bigdata-2026-10-17.html",
  "promptVersion": "1.0.0",
  "modelVersion": null,
  "voice": {
    "provider": "openai",
    "voiceId": "nova",
    "speed": 1
  },
  "presenter": {
    "name": "黃燕忠",
    "avatarVideoUrl": null
  },
  "slides": [
    {
      "slideId": "s1",
      "index": 1,
      "title": "封面",
      "sourceHash": "d97cc871904e65951f5c58beb7a36cdc870759944a00bb47dd61e6186df4f56b",
      "extractedContent": {
        "eyebrow": "",
        "kicker": "文化大學推廣部｜1151 碩專班｜2026-10-17 週六",
        "headings": [
          "2026-10-17｜巨量1151課前簡報"
        ],
        "lead": "巨量資料挖掘與分析。本週新繳件資料較少，採『複習＋PBL 工作室』版。",
        "stamp": "講師：黃燕忠｜中國文化大學兼任副教授／上市公司 AI 發展顧問 · ←→ 翻頁 · F 全螢幕 · 12 頁 · 16:9",
        "cards": [],
        "table": null,
        "flowSteps": [
          {
            "title": "開場",
            "description": "上週回顧"
          },
          {
            "title": "作業三",
            "description": "SRS 共通觀察"
          },
          {
            "title": "W4",
            "description": "最小可跑系統"
          },
          {
            "title": "工作室",
            "description": "demo 與抽查"
          },
          {
            "title": "收尾",
            "description": "下課檢查清單"
          }
        ],
        "svgLabels": [],
        "callouts": []
      },
      "script": "各位好，我是黃燕忠。今天是十月十日、第四週。本週新繳的作業比較少，所以這堂改成複習加 PBL 工作室。等一下先回顧上週，再看作業三 SRS 的共通觀察，接著把 W4 最小可跑系統講清楚。後半段各組 demo、我抽查基線、系統、證據，最後用下課檢查清單收尾。",
      "estimatedSeconds": 30,
      "status": "draft",
      "voice": {
        "provider": "openai",
        "voiceId": "nova",
        "speed": 1
      },
      "audioUrl": null,
      "audioDurationSeconds": null,
      "presenter": {
        "name": "黃燕忠",
        "avatarVideoUrl": null
      },
      "avatarVideoUrl": null,
      "captionsUrl": null,
      "cuePoints": [],
      "generatedAt": "2026-10-09T06:00:00.000Z",
      "approvedAt": null,
      "approvedBy": null,
      "generationNotes": "課前口語講稿草稿（繁中）。講師覆核前不視為核准稿。"
    },
    {
      "slideId": "s2",
      "index": 2,
      "title": "學習目標",
      "sourceHash": "b972181a263138c36d10f8d4be8ae3e797644860aa25cb0d0d3e1f91e195429d",
      "extractedContent": {
        "eyebrow": "02 / 本週學習目標",
        "kicker": "",
        "headings": [
          "從 SRS 走到最小可跑，而且能跟基線對上"
        ],
        "lead": "",
        "stamp": "",
        "cards": [
          {
            "heading": "SRS → 最小可跑系統",
            "paragraph": "挑一個功能需求，切出最短的輸入、處理、輸出。文件停在 SRS，這週還不算做完。",
            "bullets": []
          },
          {
            "heading": "可重跑的跑法",
            "paragraph": "外面附三到五行。換一台電腦、換一個人，照著跑要得到同一份輸出。",
            "bullets": []
          },
          {
            "heading": "用基線對照",
            "paragraph": "系統輸出跟現況基線比一個指標。沒有對照，就還不知道有沒有比較好。",
            "bullets": []
          }
        ],
        "table": null,
        "flowSteps": [],
        "svgLabels": [],
        "callouts": []
      },
      "script": "這週只要帶走三件事。第一，SRS 不要停在文件，要走到一個最小可跑系統，從一個功能需求切最短路徑。第二，跑法要短，三到五行，別人換一台電腦也能重跑，而且得到同一份輸出。第三，輸出要跟你的現況基線比一個指標。離開教室前，你要能指出：最小路徑是哪個功能需求、怎麼重跑、比的是哪個指標。",
      "estimatedSeconds": 31,
      "status": "draft",
      "voice": {
        "provider": "openai",
        "voiceId": "nova",
        "speed": 1
      },
      "audioUrl": null,
      "audioDurationSeconds": null,
      "presenter": {
        "name": "黃燕忠",
        "avatarVideoUrl": null
      },
      "avatarVideoUrl": null,
      "captionsUrl": null,
      "cuePoints": [],
      "generatedAt": "2026-10-09T06:00:00.000Z",
      "approvedAt": null,
      "approvedBy": null,
      "generationNotes": "課前口語講稿草稿（繁中）。講師覆核前不視為核准稿。"
    },
    {
      "slideId": "s3",
      "index": 3,
      "title": "W3–W6",
      "sourceHash": "f7170028a34e2b1e8d6fe243cf8d0d3323891080c5cafffcb28324603a079a18",
      "extractedContent": {
        "eyebrow": "03 / W3–W6 的意義",
        "kicker": "",
        "headings": [
          "四道品質門，本週停在最小可跑"
        ],
        "lead": "複習用。週次不是文號，是你要交出的證明。",
        "stamp": "",
        "cards": [
          {
            "heading": "證明現在有多痛",
            "paragraph": "",
            "bullets": [
              "數字＋期間＋口徑＋來源",
              "別人照著能重算",
              "目標值不是基線"
            ]
          },
          {
            "heading": "本週：證明做得出來",
            "paragraph": "",
            "bullets": [
              "固定樣例進、輸出表出",
              "外面附三到五行跑法",
              "流程圖不算系統"
            ]
          },
          {
            "heading": "證明不是運氣",
            "paragraph": "",
            "bullets": [
              "同一組輸入重跑，結果對得起來",
              "有對照，不是剛好跑一次",
              "對齊上線前的驗收邊界"
            ]
          },
          {
            "heading": "證明敢給人看",
            "paragraph": "",
            "bullets": [
              "前後對照＋限制／失敗一頁",
              "檔案給得出去、可重跑",
              "期末看的是這包，不是口頭"
            ]
          }
        ],
        "table": null,
        "flowSteps": [],
        "svgLabels": [],
        "callouts": []
      },
      "script": "先複習四道門。W3 是基線定稿，用數字、期間、口徑、來源講出現在有多痛，別人照著能重算。W4 就是本週，最小可跑系統，證明做得出來；流程圖不算。W5 是固定驗收集，同一組輸入重跑，結果要對得起來，證明不是剛好一次。W6 是證據包，前後對照和限制寫清楚，敢給人看才叫專案。",
      "estimatedSeconds": 30,
      "status": "draft",
      "voice": {
        "provider": "openai",
        "voiceId": "nova",
        "speed": 1
      },
      "audioUrl": null,
      "audioDurationSeconds": null,
      "presenter": {
        "name": "黃燕忠",
        "avatarVideoUrl": null
      },
      "avatarVideoUrl": null,
      "captionsUrl": null,
      "cuePoints": [],
      "generatedAt": "2026-10-09T06:00:00.000Z",
      "approvedAt": null,
      "approvedBy": null,
      "generationNotes": "課前口語講稿草稿（繁中）。講師覆核前不視為核准稿。"
    },
    {
      "slideId": "s4",
      "index": 4,
      "title": "三硬門檻與 5V",
      "sourceHash": "85518669d97728f1ba4d42801c5a593ad63078c6fcf49c229170443fb38c1a63",
      "extractedContent": {
        "eyebrow": "04 / 三硬門檻 × 5V",
        "kicker": "",
        "headings": [
          "沒過門，就還不能叫專案"
        ],
        "lead": "",
        "stamp": "",
        "cards": [
          {
            "heading": "對 W3",
            "paragraph": "數字、期間、口徑、來源要齊。缺現況基線，後面的模型先不要談。",
            "bullets": []
          },
          {
            "heading": "對 W4 · 本週",
            "paragraph": "可執行檔或 notebook，有輸入、處理、輸出與跑法。聊天截圖與流程圖都不算。",
            "bullets": []
          },
          {
            "heading": "對 W5–W6",
            "paragraph": "固定驗收集可重跑；限制與失敗寫一頁。敢給人看，才叫專案。",
            "bullets": []
          },
          {
            "heading": "5V",
            "paragraph": "",
            "bullets": [
              "Volume 資料量",
              "Velocity 更新速度",
              "Variety 資料型態",
              "Veracity 可不可信",
              "Value 有沒有用"
            ]
          },
          {
            "heading": "標「有」之前",
            "paragraph": "至少三項要標得了「有」。Value、Veracity 不得為「無」。沒有可點開的檔，最多只能標「弱」。",
            "bullets": []
          }
        ],
        "table": null,
        "flowSteps": [],
        "svgLabels": [],
        "callouts": []
      },
      "script": "三硬門檻對上這幾週：基線對 W3，系統對 W4，證據對 W5 和 W6。5V 是 Volume 資料量、Velocity 更新速度、Variety 資料型態、Veracity 可不可信、Value 有沒有用。至少三項要標得了「有」，Value 和 Veracity 不能是無。沒有可點開的檔，最多只能標弱。缺基線的模型，先不要談。",
      "estimatedSeconds": 33,
      "status": "draft",
      "voice": {
        "provider": "openai",
        "voiceId": "nova",
        "speed": 1
      },
      "audioUrl": null,
      "audioDurationSeconds": null,
      "presenter": {
        "name": "黃燕忠",
        "avatarVideoUrl": null
      },
      "avatarVideoUrl": null,
      "captionsUrl": null,
      "cuePoints": [],
      "generatedAt": "2026-10-09T06:00:00.000Z",
      "approvedAt": null,
      "approvedBy": null,
      "generationNotes": "課前口語講稿草稿（繁中）。講師覆核前不視為核准稿。"
    },
    {
      "slideId": "s5",
      "index": 5,
      "title": "AISDLC 週次對照",
      "sourceHash": "9fa33ded43bf652cd868afbb2d92a0d8588f23581cb21cb48443981d09482d13",
      "extractedContent": {
        "eyebrow": "05 / AISDLC × 週次",
        "kicker": "",
        "headings": [
          "Discover → Diagnose，對上 W1–W6"
        ],
        "lead": "AI Software Development Life Cycle。本課把專案當可治理的產品，不是一次 Demo。",
        "stamp": "",
        "cards": [],
        "table": [
          [
            "週次",
            "AISDLC",
            "這門課在做什麼"
          ],
          [
            "W1–W2",
            "Discover／Define",
            "需求盤點／Use Case"
          ],
          [
            "W3",
            "Define／Design",
            "SRS＋基線"
          ],
          [
            "W4 · 本週",
            "Develop",
            "最小可跑系統"
          ],
          [
            "W5",
            "Deploy",
            "上線前的固定驗收集"
          ],
          [
            "W6",
            "Diagnose",
            "證據包：限制、失敗、前後對照"
          ]
        ],
        "flowSteps": [],
        "svgLabels": [],
        "callouts": [
          "本週停在 Develop：先把最小系統跑起來。Define 的數字與 Diagnose 的失敗說明，仍是你的責任。"
        ]
      },
      "script": "AISDLC 六步：Discover、Define、Design、Develop、Deploy、Diagnose。對到週次是這樣：第一、二週做需求盤點和 Use Case；第三週是 SRS 加基線；本週第四週做最小系統；第五週是上線前的固定驗收集；第六週把證據包收齊。AI 可以加速 Develop，但基線數字和失敗說明還是你的責任。",
      "estimatedSeconds": 36,
      "status": "draft",
      "voice": {
        "provider": "openai",
        "voiceId": "nova",
        "speed": 1
      },
      "audioUrl": null,
      "audioDurationSeconds": null,
      "presenter": {
        "name": "黃燕忠",
        "avatarVideoUrl": null
      },
      "avatarVideoUrl": null,
      "captionsUrl": null,
      "cuePoints": [],
      "generatedAt": "2026-10-09T06:00:00.000Z",
      "approvedAt": null,
      "approvedBy": null,
      "generationNotes": "課前口語講稿草稿（繁中）。講師覆核前不視為核准稿。"
    },
    {
      "slideId": "s6",
      "index": 6,
      "title": "作業三 SRS 觀察",
      "sourceHash": "2eb48ba229e34ea712e8ec6bbd624ed8481def6617d691c60e278f10841bbcae",
      "extractedContent": {
        "eyebrow": "06 / 作業三 SRS 共通觀察（去名化）",